{
  "$schema": "../../../schema/source-manifest.schema.json",
  "accessDate": "2026-07-13",
  "sourceCount": 38,
  "sources": [
    {
      "attachmentNo": "10004184",
      "fileSizeBytes": 612234,
      "id": "kr-nec-2026-1-annex1",
      "name": "(2022 개정) 초·중등학교 교육과정 [별책1] 총론_ 국가교육위원회 고시 제2026-1호(2026.1.21.).pdf",
      "notes": "2026-1호가 총론을 개정함; PDF 59쪽; 공식 원문은 공개 데이터에 수록하지 않음.",
      "publisher": "국가교육위원회/NCIC",
      "rightsStatus": "cleared",
      "sha256": "343e41fa969209381eabebcc8cf852e4e37d91810cf59e7b8f25cb71285ef9af",
      "sourceType": "official-pdf",
      "url": "https://ncic.re.kr/inv/org/download.do?year=2026&seq=10004184&orgType=ogi4",
      "usage": "middle+high 교육과정 별책 1 코드·과목·구조 확인",
      "verificationStatus": "official-source-checked"
    },
    {
      "attachmentNo": "10004186",
      "fileSizeBytes": 8465750,
      "id": "kr-nec-2026-1-annex3",
      "name": "(2022 개정) 초·중등학교 교육과정 [별책3] 중학교_ 국가교육위원회 고시 제2026-1호(2026.1.21.).pdf",
      "notes": "2026-1호가 중학교 교육과정을 개정함; PDF 683쪽; 공식 원문은 공개 데이터에 수록하지 않음.",
      "publisher": "국가교육위원회/NCIC",
      "rightsStatus": "cleared",
      "sha256": "69da64aadd460e3889a38377d595adbe08f7fdf96f66517b23813b630702feae",
      "sourceType": "official-pdf",
      "url": "https://ncic.re.kr/inv/org/download.do?year=2026&seq=10004186&orgType=ogi4",
      "usage": "middle 교육과정 별책 3 코드·과목·구조 확인",
      "verificationStatus": "official-source-checked"
    },
    {
      "attachmentNo": "10004190",
      "fileSizeBytes": 18332068,
      "id": "kr-nec-2026-1-annex4",
      "name": "(2022 개정) 초·중등학교 교육과정 [별책4] 고등학교_ 국가교육위원회 제2026-1호(2026.1.21.).pdf",
      "notes": "2026-1호가 고등학교 교육과정을 개정함; PDF 2215쪽; 공식 원문은 공개 데이터에 수록하지 않음.",
      "publisher": "국가교육위원회/NCIC",
      "rightsStatus": "cleared",
      "sha256": "88a513e227ae6071ffe6d9dda93948c9837cc48e8b53cb6007114d10200200b7",
      "sourceType": "official-pdf",
      "url": "https://ncic.re.kr/inv/org/download.do?year=2026&seq=10004190&orgType=ogi4",
      "usage": "high 교육과정 별책 4 코드·과목·구조 확인",
      "verificationStatus": "official-source-checked"
    },
    {
      "attachmentNo": "10003553",
      "fileSizeBytes": 2078590,
      "id": "kr-moe-2022-33-annex5",
      "name": "[별책5] 국어과 교육과정.pdf",
      "notes": "후속 고시에서 대체되지 않은 국어과 기준선; PDF 222쪽; 공식 원문은 공개 데이터에 수록하지 않음.",
      "publisher": "교육부/NCIC",
      "rightsStatus": "cleared",
      "sha256": "5c30ae42a973a8f912bae156b160cd16d56636b3a64af84c3bdc378c9b482544",
      "sourceType": "official-pdf",
      "url": "https://ncic.re.kr/inv/org/download.do?year=2022&seq=10003553&orgType=ogi4",
      "usage": "middle+high 교육과정 별책 5 코드·과목·구조 확인",
      "verificationStatus": "official-source-checked"
    },
    {
      "attachmentNo": "10003738",
      "fileSizeBytes": 1412105,
      "id": "kr-moe-2022-33-annex6",
      "name": "[별책6] 도덕과 교육과정.pdf",
      "notes": "후속 고시에서 대체되지 않은 도덕과 기준선; PDF 92쪽; 공식 원문은 공개 데이터에 수록하지 않음.",
      "publisher": "교육부/NCIC",
      "rightsStatus": "cleared",
      "sha256": "0682710d786a0be26efdfbd835195e4871c71bc7c3c11f71427c7087c07a850e",
      "sourceType": "official-pdf",
      "url": "https://ncic.re.kr/inv/org/download.do?year=2022&seq=10003738&orgType=ogi4",
      "usage": "middle+high 교육과정 별책 6 코드·과목·구조 확인",
      "verificationStatus": "official-source-checked"
    },
    {
      "attachmentNo": "10003993",
      "fileSizeBytes": 4253192,
      "id": "kr-nec-2024-3-annex7",
      "name": "(2022개정) 초·중등학교 교육과정 [별책7] 사회과_ 국가교육위원회 고시 제2024-3호(2024.08.16.).pdf",
      "notes": "2024-3호 재발행 사회과 기준선; PDF 317쪽; 공식 원문은 공개 데이터에 수록하지 않음.",
      "publisher": "국가교육위원회/NCIC",
      "rightsStatus": "cleared",
      "sha256": "7383ec75add6dae0d1c2138ecfe36dc2c762ab980a96db4aafccface33979e06",
      "sourceType": "official-pdf",
      "url": "https://ncic.re.kr/inv/org/download.do?year=2024&seq=10003993&orgType=ogi4",
      "usage": "middle+high 교육과정 별책 7 코드·과목·구조 확인",
      "verificationStatus": "official-source-checked"
    },
    {
      "attachmentNo": "10003559",
      "fileSizeBytes": 1938993,
      "id": "kr-moe-2022-33-annex8",
      "name": "[별책8] 수학과 교육과정.pdf",
      "notes": "후속 고시에서 대체되지 않은 수학과 기준선; PDF 263쪽; 공식 원문은 공개 데이터에 수록하지 않음.",
      "publisher": "교육부/NCIC",
      "rightsStatus": "cleared",
      "sha256": "ba7c7c63ad31ba0fd32e5eb8148d696dd73288acce111495c593298112f8f840",
      "sourceType": "official-pdf",
      "url": "https://ncic.re.kr/inv/org/download.do?year=2022&seq=10003559&orgType=ogi4",
      "usage": "middle+high 교육과정 별책 8 코드·과목·구조 확인",
      "verificationStatus": "official-source-checked"
    },
    {
      "attachmentNo": "10004171",
      "fileSizeBytes": 2663278,
      "id": "kr-nec-2024-3-annex9",
      "name": "[별책9] 과학과 교육과정.pdf",
      "notes": "NCIC가 2025년에 교체 게시한 2024-3호 과학과 파일; PDF 292쪽; 공식 원문은 공개 데이터에 수록하지 않음.",
      "publisher": "국가교육위원회/NCIC",
      "rightsStatus": "cleared",
      "sha256": "0cf53427691d54366d6805767c428a15b0e817580807b4354947de7e3b58b738",
      "sourceType": "official-pdf",
      "url": "https://ncic.re.kr/inv/org/download.do?year=2024&seq=10004171&orgType=ogi4",
      "usage": "middle+high 교육과정 별책 9 코드·과목·구조 확인",
      "verificationStatus": "official-source-checked"
    },
    {
      "attachmentNo": "10003781",
      "fileSizeBytes": 2956125,
      "id": "kr-moe-2022-33-annex10",
      "name": "[별책10] 실과(기술가정)정보과 교육과정.pdf",
      "notes": "후속 고시에서 대체되지 않은 기술·가정/정보 기준선; PDF 222쪽; 공식 원문은 공개 데이터에 수록하지 않음.",
      "publisher": "교육부/NCIC",
      "rightsStatus": "cleared",
      "sha256": "842077c76b311f23d57e6e749a8e4ffbb3d59d37628c1646531301022cc36bfd",
      "sourceType": "official-pdf",
      "url": "https://ncic.re.kr/inv/org/download.do?year=2022&seq=10003781&orgType=ogi4",
      "usage": "middle+high 교육과정 별책 10 코드·과목·구조 확인",
      "verificationStatus": "official-source-checked"
    },
    {
      "attachmentNo": "10003695",
      "fileSizeBytes": 2371909,
      "id": "kr-moe-2022-33-annex11",
      "name": "[별책11] 체육과 교육과정.pdf",
      "notes": "후속 고시에서 대체되지 않은 체육과 기준선; PDF 125쪽; 공식 원문은 공개 데이터에 수록하지 않음.",
      "publisher": "교육부/NCIC",
      "rightsStatus": "cleared",
      "sha256": "49cdef2bbcdf1decb796204ab66a0b6a308cd2903ead7168dde892b1f48cf2fb",
      "sourceType": "official-pdf",
      "url": "https://ncic.re.kr/inv/org/download.do?year=2022&seq=10003695&orgType=ogi4",
      "usage": "middle+high 교육과정 별책 11 코드·과목·구조 확인",
      "verificationStatus": "official-source-checked"
    },
    {
      "attachmentNo": "10003999",
      "fileSizeBytes": 1943652,
      "id": "kr-nec-2024-3-annex12",
      "name": "(2022개정) 초·중등학교 교육과정 [별책12] 음악과_ 국가교육위원회 고시 제2024-3호(2024.08.16.).pdf",
      "notes": "2024-3호 재발행 음악과 기준선; PDF 96쪽; 공식 원문은 공개 데이터에 수록하지 않음.",
      "publisher": "국가교육위원회/NCIC",
      "rightsStatus": "cleared",
      "sha256": "54af8340687ace3599f5242dcc6d4d95382af24144be186fa6c4b246417d0487",
      "sourceType": "official-pdf",
      "url": "https://ncic.re.kr/inv/org/download.do?year=2024&seq=10003999&orgType=ogi4",
      "usage": "middle+high 교육과정 별책 12 코드·과목·구조 확인",
      "verificationStatus": "official-source-checked"
    },
    {
      "attachmentNo": "10003555",
      "fileSizeBytes": 1983114,
      "id": "kr-moe-2022-33-annex13",
      "name": "[별책13] 미술과 교육과정.pdf",
      "notes": "후속 고시에서 대체되지 않은 미술과 기준선; PDF 76쪽; 공식 원문은 공개 데이터에 수록하지 않음.",
      "publisher": "교육부/NCIC",
      "rightsStatus": "cleared",
      "sha256": "b47363c9a1060b00777c6de555d972b509b64b886d7beca89460a552a33c77b2",
      "sourceType": "official-pdf",
      "url": "https://ncic.re.kr/inv/org/download.do?year=2022&seq=10003555&orgType=ogi4",
      "usage": "middle+high 교육과정 별책 13 코드·과목·구조 확인",
      "verificationStatus": "official-source-checked"
    },
    {
      "attachmentNo": "10004085",
      "fileSizeBytes": 2719273,
      "id": "kr-nec-2024-3-annex14",
      "name": "(2022개정)초·중등학교교육과정[별책14]영어과_국가교육위원회고시제2024-3호(2024.08.16.).pdf",
      "notes": "2024-3호 재발행 영어과 기준선; PDF 306쪽; 공식 원문은 공개 데이터에 수록하지 않음.",
      "publisher": "국가교육위원회/NCIC",
      "rightsStatus": "cleared",
      "sha256": "7f0ada9d732b475b2c64d45ea8b066cc8a78d3cf6c1368640b9b8943e1453331",
      "sourceType": "official-pdf",
      "url": "https://ncic.re.kr/inv/org/download.do?year=2024&seq=10004085&orgType=ogi4",
      "usage": "middle+high 교육과정 별책 14 코드·과목·구조 확인",
      "verificationStatus": "official-source-checked"
    },
    {
      "attachmentNo": "10003762",
      "fileSizeBytes": 9552384,
      "id": "kr-moe-2022-33-annex16",
      "name": "[별책16] 제2외국어과 교육과정.pdf",
      "notes": "후속 고시에서 대체되지 않은 제2외국어과 기준선; PDF 670쪽; 공식 원문은 공개 데이터에 수록하지 않음.",
      "publisher": "교육부/NCIC",
      "rightsStatus": "cleared",
      "sha256": "442629889f75ad2f8544936008b445b46a42ea3e54786c8f57b7e764be920339",
      "sourceType": "official-pdf",
      "url": "https://ncic.re.kr/inv/org/download.do?year=2022&seq=10003762&orgType=ogi4",
      "usage": "middle+high 교육과정 별책 16 코드·과목·구조 확인",
      "verificationStatus": "official-source-checked"
    },
    {
      "attachmentNo": "10003750",
      "fileSizeBytes": 1799702,
      "id": "kr-moe-2022-33-annex17",
      "name": "[별책17] 한문과 교육과정.pdf",
      "notes": "후속 고시에서 대체되지 않은 한문과 기준선; PDF 63쪽; 공식 원문은 공개 데이터에 수록하지 않음.",
      "publisher": "교육부/NCIC",
      "rightsStatus": "cleared",
      "sha256": "e3466e192e1e3943b669ff627ae19c5f223d7f0fb8b2c52fe7bac63be13d7301",
      "sourceType": "official-pdf",
      "url": "https://ncic.re.kr/inv/org/download.do?year=2022&seq=10003750&orgType=ogi4",
      "usage": "middle+high 교육과정 별책 17 코드·과목·구조 확인",
      "verificationStatus": "official-source-checked"
    },
    {
      "attachmentNo": "10004037",
      "fileSizeBytes": 1387377,
      "id": "kr-nec-2024-3-annex18",
      "name": "(2022개정) 초·중등학교 교육과정 [별책18] 중학교 선택교과_국가교육위원회 고시 제2024-3호(2024.08.16.).pdf",
      "notes": "현행 중학교 선택 교과 기준선; PDF 65쪽; 공식 원문은 공개 데이터에 수록하지 않음.",
      "publisher": "국가교육위원회/NCIC",
      "rightsStatus": "cleared",